Interview Text,Dominant_Topic,x,y
"The field crew at University of Arizona, they were my best buds. Johnny O., he was the director, he still is today. And the mound was absolutely gorgeous, the grass, there wasn't one flaw. So definitely University of Arizona.",5,17.219618,6.929392
"First, just congratulations to Minnesota on a great season. They're a great Team. We saw them early and they definitely presented some unique challenges.",6,6.3634443,22.497725
Not really. We were just worrying about today. We knew that going in I guess there wasn't any reserve day. Hopefully the forecast changes. I've seen that happen before. And hopefully we get two really good semifinals in.,4,-26.857815,-13.790403
You're obviously one of the leading players on the LET at the moment.  Does that put extra pressure on you coming in this week against players from America?,3,-26.74595,9.36182
"Yeah, it's definitely uncharted territory. And I'm just trying to continue to do what I've tried to do all year, is just take it one day at a time and just listen to the body.",1,19.43782,-13.951894
"Yeah, because that's not coming from the players on the field. The players on the field, it's their job to guard against the players on the field. You can't guard against technology and players off the field.",7,11.735911,29.345558
"Gee, this is a Lisa Raymond -- Natasha Zvereva press conference. I don't know. Frankly, I don't know. I don't think anything lacking. She is playing good.",5,18.301926,6.3900046
I had injured it the Friday just before the Monday at San Diego the tournament practicing.  I would probably say it affects me most definitely running.  On my serve and my backhand.,6,-8.660979,23.958988
"Well, right now, based on what the organization make the move, we hired -- they hired him, before I got here, to be the closer. So that's something that we have to talk about.",0,1.4103228,-24.754412
"Yeah, I appreciate the question. I think a lot -- people have spoken on this. I've spoken on this, I addressed it right away. Jeff just spoke.",7,12.059007,29.251001
"The key for them is clearly Plummer. If she's good, then that creates space for everyone else. Everyone else can take a little breath. If they have to lean on everyone else, it gets a little bit different.",3,-25.491735,10.027769
"We're excited to have with us a number of players who were named to the first and second Teams. Join me in welcoming the All-MLB second Team, designated hitter of the Houston Astros, Yordan Alvarez is with us.",0,-1.9491271,-29.311201
"I think I will not miss cricket -- I mean, I'll be involved because I can't stay away from this. And somehow I'll be involved with cricket.",6,-9.437288,23.978165
"You know, I can't say we practice it a ton.  We talk about power play, that sort of thing.  Then defending also I think is something we cover and talk about.",7,12.09952,20.806084
"  I think I definitely left  -- I did yesterday, as well.  You know, one of my  -- one of my things about this golf course is that I just don't read those greens well.",5,11.885314,8.472776
"  Yeah, so coming from KPMG I was extremely happy with my long game from tee to green, but the putts were not really dropping that week.",7,12.038675,27.995052
"  Is that aggressive?  (Laughs.) No, I think I played pretty well.  I'm getting it in the fairway, and then I really hit some good iron shots today.",2,-3.9018512,3.9689088
Very happy with the home run. Obviously today all my Teammates were saying today is your day. Today is your day. And it happened so obviously very happy about it.,4,-26.359243,-13.781721
" I think I was very tired -- I was tired because I have been all the week with diarrhea, because the food here is not very good for me.  I was very tired, the whole match.",2,-3.6781473,-0.60442847
" Yeah, a big surprise.  I was really surprised about; especially Jennifer yesterday.  I knew she had a tough match yesterday.  It wasn't going to be easy, but I didn't think she was going to lose.",2,3.6711688,3.5502045
" When the rankings were first released, she was ranked third.  I think any time you have a prominent player, there's always discussion.  Anyone who you ask, whether there's resistance or discussion, that's up for debate.",2,-5.575593,-2.9702976
"I think it affected our Team.  You know, I think collectively a lot of things affected our Team.  I do think that affected our Team.",5,17.203802,6.416902
We started on the back nine and I started off hitting a 5-iron in there probably 18 feet from the hole and knocked it in for birdie.,1,18.14789,-12.072817
" He was serving for the match at 5-1.  He was Love-all; he had hit a smash wide, real wide, and it was- -",6,-8.920816,21.568262
" You know, that's a hard question to answer simply because you haven't replaced it with another event.  The answer would probably be yes, I would have played, and I would have taken the  same approach.",7,11.850811,30.238169
"It was tough for him, first game back.  That's a big game.  Obviously they didn't get a whole lot of time up there, so it's hard to evaluate it that much.",2,-6.952652,1.7540433
"Sure, I'm appreciative that the officials allowed it to be an aggressive game and they allowed big, physical contact to happen.",7,11.650529,26.442205
"  Well, you know, I don't think I was consciously thinking about the game at that time, but you pick up things if you're an independent kid.",0,-2.941581,-28.296232
" We have world No. 1, Annika Sorenstam, the recent winner of the U.S. Women's Open and also the lady who won here in 2003.  There must be some good memories you have here.",4,-21.800962,-16.27966
"  Well, start off with our Captain, Sue Bird, just leading us and it goes from the starting five all the way down to the players on the bench as well.",3,-26.010504,9.773096
"  I'm sure she is.  They're both great.  Pat was a pod captain last year too so I got to know her pretty well.  Yeah, they're both just great.",7,12.398316,29.30811
I don't know that it's been a bit of a struggle and I think some of what's been identified as a struggle is explosive displays compared to what some of our Teams have done in the past.,5,13.682384,8.084293
"Yes, we missed him in the first half and any conversations I have with him on whether he's coming back or what he's doing I will share with him and probably not anybody in here.",4,-24.60167,-15.227183
Today I went to the net a lot.  I felt very good.  There are going to be players where I am going to have to come in more.  I am working on that.  It is much better.,5,20.32208,6.333401
"  You know, weather is really good and golf course is really good condition right now, so everybody -- I know everybody play well starting weekend, right?",7,12.137425,31.725584
" I think size-wise, they compare to Nebraska close enough, their center is about the same size, the way their tackles would be, physical.  Just the quickness of the center, I'd say probably the most they compare to is Nebraska.",6,-6.084247,21.393051
"  Lopez?  Yeah, I've faced him plenty of times, yeah, when he was with the Indians and this year with the Devil Rays.  He's a pitcher that comes right at you and I was looking to get at it right away.",7,11.74891,29.315851
"We have a really good Team. We have a lot of good things going. We have -- we're trying to build the 2020 Team. Our energy's been spent on that. Obviously, it's been a different off-season for us.",4,-26.351068,-14.5758505
"  Well, there's not uncertainty in my mind with LeBron James.  And [when] I took the job, we didn't have Anthony Davis.  We didn't have the whole Team.  It was a different Team after the fact.",4,-25.892899,-14.700237
" I think it's just work has been paying off and I did good last year, I just didn't have any wins.  But I was playing good.",2,-3.9360437,-1.6364974
There's no doubt there's been a lot more time going into data and watching games. And there's so much footage now these days that you can't really hide.,4,-25.128656,-14.616302
" Yeah, sure, she was.  She was making some doublefaults or easy volley mistakes and -- I mean, she is always a little bit nervous when it is getting close.  Yeah, she was, definitely.",7,6.9945054,22.574226
"Look, we know we're a great fielding unit. We normally have one of those games somewhere along the line. I'm just happy it's gone now, and I know the Team is going to do better next time.",5,21.98074,6.1811705
"But Yadi can hit anywhere. Hit second for us, third, fourth, fifth. He can hit anywhere because Yadi has an approach, and so he's going to be productive.",4,-23.964388,-15.888749
I'm living the dream. I know this is a big opportunity for me. It's a big year for me. And I'm going to do my best every outing and enjoy the time.,1,20.143505,-15.194853
Feel really good.  I was just thinking like I don't want to discredit my round just because I played a couple bad holes towards the end of the day.,0,0.049644783,-31.55959
"I thought we were disciplined. We weren't trying to do so much. I think when we've gone back and we watch how we defended her in the past, I thought it looked like a very undisciplined, poor-coached Team.",2,-6.9685364,-4.8333163
"  I mean, it definitely is a high percentage if I have a few days.  But like I said, I'm making some progress, then some days I'm the same.  We'll see.  We'll see.",3,-21.88482,8.640915
Just I think my game just is finally coming together.  I'm really comfortable my swing.  My PXG equipment has been working fantastic for me.,5,12.951158,11.119313
"Yeah, it definitely helps when you can get -- see their bullpen. This way you know in a long series like that you know who you're going to face, if you face them again, and what they have.",1,15.7769985,-8.737569
"Yeah, I talked to him a little bit in Houston. A lot of guys who I've played with, we've gone through a couple of levels here and being able to play against somebody else, it's great.",7,12.383462,31.505987
"I started on 1, so first hole I hit a sand wedge about a foot, got it in my range.  I hit a 9-iron about two feet.",1,18.714779,-13.518398
"No, we're trying to win today's game. I'll empty my own tank. There's certainly a couple of guys that I'm not going to use; Greinke and Cole. But we're trying to win today's game.",0,1.090238,-24.942896
I know what the boards feel like (laughter).  I was a little bit confused where he was.  It was six-on-five.  You're just trying to find a spot to stand.  I was tired so I parked it in front.,3,-27.0209,9.818041
"To talk about what Matt was saying and his lacrosse IQ, it was in the fall last year, it was freshmen fall.",7,10.7752,21.730307
"Every off-season we go through our baseball operations policies. Sign stealing was a big focus during the off-season last year, and I expect it will be this year as well.",2,-4.6661415,-2.3650532
"Yeah, he's in the clubhouse now. He's going to get treatment. He's going to do everything he can to try to get ready.",4,-23.190697,-16.384998
" I have played Sampras at Wimbledon this year, and that was a big match for me.  I didn't play too bad.  I played a few other guys.",7,11.648551,26.466145
"It's amazing to see.  This is a hockey town.  They've been with us through the ups and downs.  They're excited.  This is something new and special, and they're a big part of it, a big piece of it.",1,14.303453,-12.935992
I think you heard Erik say in the previous interview there would probably be even more wrecks. We certainly don't need more wrecks than what we saw today. Probably not.,5,12.195962,14.036115
I think everybody is excited about the game.  They have enjoyed their experience and they are going to be ready to play.,0,-2.1276062,-24.54779
"I think you're always looking for pitching. I don't know that you ever have enough. I don't know. We'll see what's out there, see whatever. But like I say, I don't think you can ever have enough starting pitchers.",0,0.4962311,-31.849234
"It's a little different than our old stadium, it's got some jagged edges around the outfield. It's going to take some time.",2,-3.2746286,-0.861568
 You probably are not going to see us two doing a Stance Little League Clinic.  We are probably the two worst guys you would want to have your kids going up there and hitting like.  (Laughter.),1,19.93756,-14.81498
"Yeah, I mean, of course you want to win every game.  I think if you think you're going to sweep every Team or the games that are left, I think you're maybe in a fantasy world.",5,22.458828,6.334271
"It would be great for us, great for the Team, great for him.  He's locked in, laser like focus going into this ballgame and practicing well, preparing really well.  Not going to let himself get beat in this game.",6,-7.169349,20.79806
"  Yes.  Definitely got a lot of congratulations from Mike Whan, for example.  He texted me right after the third round last week, so that felt really special.",4,-25.941011,-13.942261
"  So I been working more on like short game and bunker play and putting as well.  Putting obviously has been paying off.  Short game, not so much so far.  That can change this week.",2,-8.039224,-4.9258065
I've been texting him. We've been trying to call and missing each other. He's been hunting in Ohio and somewhere else.,5,12.206192,2.7502315
" No, I actually got a wild card.  I received an invitation to play Doral as kind of a home player, I live only an hour north of Doral.",2,-3.8838933,-20.255259
We had three-hour training camp practice yesterday (laughing).  It's just prep.  Normal prep in between games.  Our guys are ready.,2,-3.9341106,-1.6334172
  Have you ever played in a tournament and the location was so beautiful that you decided to come back for a vacation?  Is Lake Oconee going to be one of your new vacation spots?,5,15.292988,6.579321
"Maybe a chip. I think when you play some of the Teams we play in our division so much, it's probably best not to seen think about it. Using it as ray positive or a negative, just go play.",5,21.041584,6.2593436
 He was -- it was his back because I saw him in the locker room it was his back.  Which probably coming from the serve.,7,11.0995865,22.153172
" We have by far and away the No. 1 player from the Ladies European Tour, Gwladys Nocera.  You've won three times and you're obviously got to be fairly confident coming in.",1,19.605288,-14.489703
"  Yeah, again, we're our own worst enemy sometimes.  Our turnovers tonight really hurt us badly, unforced turnovers.  We're in a good position.  They're a very fine basketball Team and you can't make those kind of blunders against them.",7,11.763311,29.291725
"  Well, you know, you're cooking for yourself, paying for your own school.  So you're not living high on the hog, I guess you could say.",3,-26.26607,10.352415
"It means a lot.  We're lucky to have them.  They've been here for us all year, before that, too.  You look to them, can feel comfort in that, follow in their footsteps, know you're walking in the right direction.",3,-27.73614,9.503964
"  Yeah, I was just pushing.  I was hustling the car, driving as hard as I could, trying to enjoy myself.  I really enjoyed the race conditions, love driving a full race.  It's my favorite part of the weekend.",6,-9.319657,24.99657
"  One was sand wedge, and one was my fat baby, 60-degree lob-wedge.  Usually I use that one mostly around the green and in the heavy stuff.  It just came out a little strong.",6,-9.41643,23.57012
" I thought that if I play my best I know that there is a possibility to win, so it wasn't a big surprise for me.",0,-3.8178608,-26.152441
"  Those guys do a great job.  I don't think the height is a key thing.  I think, again, we've just got to make plays.",5,12.805263,4.9938354
"The meetings will probably get longer because he won't get up and leave after he gets bored. Definitely lose some entertainment value, for sure. ",2,-3.8781588,3.429138
"So a part of our tactics are bowling according to stumps, stump to stump. That's the field we employ. But we did not hit those lengths or those lines. Yeah, it just wasn't working for us today.",4,-23.963596,-15.890748
" I've got a bunch of family in town, so I'll probably just be at home and entertain all of the family that I've got in town.",1,19.260767,-15.103169
 It was the same thing last week at Evian.  But I guess that's what we call experience and hopefully I will get that one day and I won't be so stressed in front of these girls.,0,-2.9541225,-28.281683
" No, it was very tough today because it is true, somewhere I have to beat Masur because his ranking is less than mine, and I beat Courier and everybody wait, I am winning, so it was very difficult today.",0,-0.7357992,-29.961884
" I don't know.  I hope so, but I am not working with the French Federation, so I think my coach will be very happy.",5,15.284068,6.75663
"I think the biggest thing was we went out there, and we're trying to have so much fun. And you'll sit back and review what you're doing, and you get to play the game with the people you love.",5,21.049385,6.8455396
"My opinion really doesn't matter, so I don't normally give it.  Say what I say, so I'm not going to give my opinion.",0,-3.6417377,-27.187378
"Again, I think it brought us together, kind of similar to this game, like we're in this, and when we can turn it on, it's dangerous.",1,17.361004,-11.0132265
" It is not nice.  It is not nice.  It needs to be get better, everyone wants it to be better, but I don't think we have enough power, I don't think we have right people to change it.",0,0.52141345,-31.131105
" Well, I thought it was    to me, the holes played, the into the winds holes I did better on those I think because you can control your ball.  Just wherever it landed, it was going to stay.",0,-2.5218146,-27.966072
"No, today we made mistakes in fielding and dropped some catches. That's the difference between our Team and the England Team.",6,-7.9733634,21.24287
" I'm not too concerned.  I don't really look around the stadium to see who's watching or how many people are there, I try to keep myself focused-- what was the question exactly?",2,-7.5112195,-4.3052125
"  I'm in great shape.  I bounce back extremely well in between games.  I could play right now if we had to play right now, at a high level.",5,19.415651,6.7142615
" Yeah. I mean, it helps a lot just to look to the side and see that you have people there who are with you, and you know it gives you some strength and it makes you feel good.",7,12.386481,29.286045
" That means playing on the baseline and finishing the point with the winner, with the volley or something.  So the points will be longer than they were today.  And that will take a lot of mental concentration.",7,7.6459284,22.617432
"No, it was never like that.  Every week I felt like I could win because my practice was so good.",2,-3.2769177,-0.87490773
" Yes.  Birdie on 4, on 4 I hit a 3-wood off the tee and I hit a 6-iron in there about 12 feet just below the hole and made that for birdie.",1,18.714697,-13.517969
"Well, I remember him hitting against me in Spring Training. And I would expect him to be looking for a fastball after the first at-bat.",3,-25.064835,10.419993
" Alicone (ph).  His birthday is today.  Yesterday he was joking, ""You're just waiting for a good round tomorrow, it's my birthday.""  So, I'm glad.  He's been my coach for a long time.",3,-7.7957177,4.3424764
"Yeah, I think it gives negative mojo to your Team if you think of how many goals you're down by.  Instead we take it, like I said earlier, play-by-play.  I think that's what got us out of that hole.",5,13.277335,2.7029965
"It's something that I have done. It's something -- it has to be the right time situationally when you are talking about a player, whether it's your player or someone that potentially can come play for you.",2,-3.8998408,4.1580853
" No.  I just work on everything the same for three years now with my new coach.  So the same every day, like a magician that works on his piano, so it's the same, work, work, would.",2,-4.6608715,-2.3597918
I think just what I expect out of him.  I know he's a goal-scorer.  He scores lots of goals every year.  But there's a lot more to his game than that.  I think that needed to come out.,5,10.951431,5.102442
" Of course.  Yeah, to beat Becker in a Grand Slam that he won before, it is just great. Nothing compares to this, for sure.",5,12.899573,11.28236
" I don't think there will be an effect, because they have other players, as well.  So we can't just go in there saying, we have to play different, we're going to play the same way.",5,17.217611,6.928958
"Yeah, it's just the game management, and you're expecting -- I'm not going to go all into it, but I have confidence, I had confidence in Kenley.",7,12.14343,25.200287
"  Yeah, 100%.  I was not happy about that.  I was not happy.  But the bunkers are usually -- I like bunkers a lot so I just kind of went, No.",4,-23.189201,-16.385258
"Yeah, you're going to see Teams doing some uncharacteristic things just because they know their season's on the line, they'll give everything they've got. We have to be patient and ready to respond to whatever they throw at us.",1,20.037388,-15.672952
" I think she is a great player and she really puts a lot in the game on the court and off the court.  I hope she is still around for quite a few more years, at least.",4,-25.400177,-15.070389
" It was only two feet wide.  First point he served for it.  It is a huge point, and it just pissed me off.  I had just got into it from there on.",1,17.477045,-10.857083
" Well, it is best she has played for a while.  She has a tendency to do that against me. Bad luck.",7,10.7756,21.731564
"For sure. I had a pretty good familiarity with the National League West, not just as the manager of the Giants, but also coming to play in the National League West as the manager of the Phillies.",2,-3.8991017,4.1814346
"Yeah, we stopped the bleeding last night and then came out and played well again today. We want to just keep it rolling.",7,11.461636,22.72732
" Yes, I did.  And they did some work on it.  They gave me some medication and so on and so on.  But not good enough.",7,10.776373,21.732363
"We knew Ohio State was going to come out aggressive in that second half, just like they normally do.  We wanted to continue to be aggressive from our part.",6,-8.869047,24.547962
" The best way I can describe it is that this kind of golf suits my game.  Like for instance, at the U.S. Open, I fared okay, but I never had great finishes.",2,-5.572804,-2.9674942
"We can be better, period.  I thought we were good in front of them.  A couple of bad breakdowns we didn't capitalize on.  I thought we were solid in terms of the overall play, Team defense.",0,0.51561934,-31.129326
" Twice.  I played Tuesday, I was in the Pro Am, but before I got to here, I played Friday and Saturday, that was it.",7,11.099629,22.153168
"So they've got to qualify now to make it.  Every now and then that's going to happen, but it seems to be happening more and more in the Ryder Cup.",1,13.916472,-13.052847
  This golf course is beautiful.  I've never been in area so it's a really pleasant surprise.  It's just so cool seeing all the boats.  People are actually allowed to see us I guess on the boats.,6,-9.468896,24.512697
"No, we try not to worry about any of that.  We just try to go out there and do our jobs and play.",2,-3.1246707,1.3287588
"I think we've come a long way, as we have really over the course of decades.  I think the league is in a bigger, better, stronger place.  That starts with the product on the ice.",5,21.047047,6.8453627
It could be. I'm not a big room service guy. I like to go out and eat. Houston has got some pretty good restaurants that I like.,2,-6.610404,-4.32442
" I think it is hardcourt.  I mean, even though he won his first Slam on the clay, I think hardcourt has had his best results.",5,16.214346,6.6852345
I can share that I've been a fan of both players for a long time. I can share that in Philadelphia we thought about Kevin quite a bit. And we were fans then; I'm still a fan today.,1,19.434408,-15.750656
"  I mean, I'm doing everything what I can do.  It does feel better than when it happened.  But you know, we'll see.  I mean, I don't have no timetable yet.",5,13.651679,8.111562
"  No, I've always been a guy who kind of let his game do the talking.  But when guys get to talking, I can do that, as well.  I've always tried to let my game do the talking.",1,19.272873,-15.095819
" We asked for a wildcard, three, four weeks ago, maybe.  I decided to play New Haven and Schenectady and here and asked for wildcards in all three.",2,-4.2204847,-1.3897418
" You got off to a very fast start, two birdies in the first two holes, would you like to talk about that?",3,-25.061857,10.418283
" I kind of enjoyed it.  I didn't enjoy the fourth set.  Did not enjoy that at all.  I enjoyed the match.  I enjoyed the first three sets, but I'd like to go out and do that fourth set again.",6,-8.699918,24.986822
"We have it on the outside of the case packs for our own uses that we know. That's part of the recommendation, is to better develop a tracking mechanism all the way through.",0,-0.62622815,-21.60049
" Yeah, I think we start to play very nervous.  We didn't play so good today, but I think we have a great job in this tournament and I hope next year we are going to win the tournament.",5,14.025479,3.9515681
"I echo everything. If we look too far ahead, we get lost. Even taking it one point at a time, we're not looking too far ahead or in the past, we're just focused on the here and the now.",2,-7.505105,-4.3237104
"Absolutely. That's what you call a perfect pitch right there, a pitcher's pitch. And I was able to lay it off. I thought it was a little off. I haven't seen a replay of that pitch.",0,-3.9463515,-23.906265
"  Yeah, probably.  They have a deeper bench, there's no question and I think that gives them more of an advantage over the other National League clubs.",4,-25.401005,-15.070127
